{
	"info": {
		"_postman_id": "261b1b5b-9b0d-4bc0-b5ad-90ada18ad1cf",
		"name": "Colección",
		"description": "### Welcome to Postman! This is your first collection. \n\nCollections are your starting point for building and testing APIs. You can use this one to:\n\n• Group related requests\n• Test your API in real-world scenarios\n• Document and share your requests\n\nUpdate the name and overview whenever you’re ready to make it yours.\n\n[Learn more about Postman Collections.](https://learning.postman.com/docs/collections/collections-overview/)",
		"schema": "https://schema.getpostman.com/json/collection/v2.1.0/collection.json",
		"_exporter_id": "45364407",
		"_collection_link": "https://kevinchipana.postman.co/workspace/Kevin-Chipana's-Workspace~3479ad62-7107-4573-8419-313dcd4a2b84/collection/45364407-261b1b5b-9b0d-4bc0-b5ad-90ada18ad1cf?action=share&source=collection_link&creator=45364407"
	},
	"item": [
		{
			"name": "Traer personajes",
			"event": [
				{
					"listen": "test",
					"script": {
						"exec": [
							"pm.test(\"Status code is 200\", function () {",
							"    pm.response.to.have.status(200);",
							"});"
						],
						"type": "text/javascript",
						"packages": {}
					}
				}
			],
			"request": {
				"method": "GET",
				"header": [],
				"url": {
					"raw": "https://dragonball-api.com/api/characters?page=2&limit=5",
					"protocol": "https",
					"host": [
						"dragonball-api",
						"com"
					],
					"path": [
						"api",
						"characters"
					],
					"query": [
						{
							"key": "page",
							"value": "2"
						},
						{
							"key": "limit",
							"value": "5"
						}
					]
				},
				"description": "Esta petición trae a todos los personajes de una página, respetando el limite establecido, en este caso es 5.\n\n``` java\n{\n    \"items\": [\n        {\n            \"id\": 6,\n            \"name\": \"Zarbon\",\n            \"ki\": \"20.000\",\n            \"maxKi\": \"30.000\",\n            \"race\": \"Frieza Race\",\n            \"gender\": \"Male\",\n            \"description\": \"Zarbon es uno de los secuaces de Freezer y un luchador poderoso.\",\n            \"image\": \"https://dragonball-api.com/characters/zarbon.webp\",\n            \"affiliation\": \"Army of Frieza\",\n            \"deletedAt\": null\n        },\n        {\n            \"id\": 7,\n            \"name\": \"Dodoria\",\n            \"ki\": \"18.000\",\n            \"maxKi\": \"20.000\",\n            \"race\": \"Frieza Race\",\n            \"gender\": \"Male\",\n            \"description\": \"Dodoria es otro secuaz de Freezer conocido por su brutalidad.\",\n            \"image\": \"https://dragonball-api.com/characters/dodoria.webp\",\n            \"affiliation\": \"Army of Frieza\",\n            \"deletedAt\": null\n        },\n        {\n            \"id\": 8,\n            \"name\": \"Ginyu\",\n            \"ki\": \"9.000\",\n            \"maxKi\": \"25.000\",\n            \"race\": \"Frieza Race\",\n            \"gender\": \"Male\",\n            \"description\": \"Ginyu es el líder del la élite de mercenarios de mayor prestigio del Ejército de Freeza, la cual lleva el nombre de Fuerzas Especiales Ginew en su honor[9].\",\n            \"image\": \"https://dragonball-api.com/characters/ginyu.webp\",\n            \"affiliation\": \"Army of Frieza\",\n            \"deletedAt\": null\n        },\n        {\n            \"id\": 9,\n            \"name\": \"Celula\",\n            \"ki\": \"250.000.000\",\n            \"maxKi\": \"5 Billion\",\n            \"race\": \"Android\",\n            \"gender\": \"Male\",\n            \"description\": \"Cell conocido como Célula en España, es un bioandroide creado por la computadora del Dr. Gero, quien vino del futuro de la línea 3 con la intención de vengarse de Goku por haber acabado con el Ejército del Listón Rojo, y con ello el sueño de todo villano: dominar el mundo. Es el antagonista principal del Arco de los Androides y Cell.\",\n            \"image\": \"https://dragonball-api.com/characters/celula.webp\",\n            \"affiliation\": \"Freelancer\",\n            \"deletedAt\": null\n        },\n        {\n            \"id\": 10,\n            \"name\": \"Gohan\",\n            \"ki\": \"45.000.000\",\n            \"maxKi\": \"40 septillion\",\n            \"race\": \"Saiyan\",\n            \"gender\": \"Male\",\n            \"description\": \"Son Gohanda en su tiempo en España, o simplemente Gohan en Hispanoamérica, es uno de los personajes principales de los arcos argumentales de Dragon Ball Z, Dragon Ball Super y Dragon Ball GT. Es un mestizo entre saiyano y humano terrícola. Es el primer hijo de Son Goku y Chi-Chi, hermano mayor de Son Goten, esposo de Videl y padre de Pan.\",\n            \"image\": \"https://dragonball-api.com/characters/gohan.webp\",\n            \"affiliation\": \"Z Fighter\",\n            \"deletedAt\": null\n        }\n    ],\n    \"meta\": {\n        \"totalItems\": 58,\n        \"itemCount\": 5,\n        \"itemsPerPage\": 5,\n        \"totalPages\": 12,\n        \"currentPage\": 2\n    },\n    \"links\": {\n        \"first\": \"https://dragonball-api.com/api/characters?limit=5\",\n        \"previous\": \"https://dragonball-api.com/api/characters?page=1&limit=5\",\n        \"next\": \"https://dragonball-api.com/api/characters?page=3&limit=5\",\n        \"last\": \"https://dragonball-api.com/api/characters?page=12&limit=5\"\n    }\n}\n\n ```"
			},
			"response": []
		},
		{
			"name": "Buscar personajes por ID",
			"event": [
				{
					"listen": "test",
					"script": {
						"exec": [
							"pm.test(\"Status code is 200\", function () {",
							"    pm.response.to.have.status(200);",
							"});"
						],
						"type": "text/javascript",
						"packages": {}
					}
				}
			],
			"request": {
				"auth": {
					"type": "noauth"
				},
				"method": "GET",
				"header": [],
				"url": {
					"raw": "https://dragonball-api.com/api/characters/6",
					"protocol": "https",
					"host": [
						"dragonball-api",
						"com"
					],
					"path": [
						"api",
						"characters",
						"6"
					]
				},
				"description": "Esta petición nos permite buscar a un personaje en especifico dependiendo de su ID.\n\n``` json\n{\n    \"id\": 6,\n    \"name\": \"Zarbon\",\n    \"ki\": \"20.000\",\n    \"maxKi\": \"30.000\",\n    \"race\": \"Frieza Race\",\n    \"gender\": \"Male\",\n    \"description\": \"Zarbon es uno de los secuaces de Freezer y un luchador poderoso.\",\n    \"image\": \"https://dragonball-api.com/characters/zarbon.webp\",\n    \"affiliation\": \"Army of Frieza\",\n    \"deletedAt\": null,\n    \"originPlanet\": {\n        \"id\": 4,\n        \"name\": \"Freezer No. 79\",\n        \"isDestroyed\": true,\n        \"description\": \"Planeta artificial utilizado por Freezer como base de operaciones y centro de clonación.\",\n        \"image\": \"https://dragonball-api.com/planetas/PlanetaFreezer.webp\",\n        \"deletedAt\": null\n    },\n    \"transformations\": [\n        {\n            \"id\": 18,\n            \"name\": \"Zarbon Monster\",\n            \"image\": \"https://dragonball-api.com/transformaciones/zarbon monster.webp\",\n            \"ki\": \"30.000\",\n            \"deletedAt\": null\n        }\n    ]\n}\n ```"
			},
			"response": []
		},
		{
			"name": "Post data",
			"event": [
				{
					"listen": "test",
					"script": {
						"type": "text/javascript",
						"exec": [
							"pm.test(\"Successful POST request\", function () {",
							"    pm.expect(pm.response.code).to.be.oneOf([200, 201]);",
							"});",
							""
						]
					}
				}
			],
			"request": {
				"method": "POST",
				"header": [],
				"body": {
					"mode": "raw",
					"raw": "{\n\t\"name\": \"Add your name in the body\"\n}",
					"options": {
						"raw": {
							"language": "json"
						}
					}
				},
				"url": {
					"raw": ""
				},
				"description": "This is a POST request, submitting data to an API via the request body. This request submits JSON data, and the data is reflected in the response.\n\nA successful POST request typically returns a `200 OK` or `201 Created` response code."
			},
			"response": []
		},
		{
			"name": "Mostrar todos los personajes",
			"request": {
				"auth": {
					"type": "noauth"
				},
				"method": "GET",
				"header": [],
				"url": {
					"raw": "https://dragonball-api.com/api/characters",
					"protocol": "https",
					"host": [
						"dragonball-api",
						"com"
					],
					"path": [
						"api",
						"characters"
					]
				},
				"description": "Esta URL nos permite traer a todos los personajes cargados en la página, pero el creador puso un limite de 10.\n\n``` json\n{\n    \"items\": [\n        {\n            \"id\": 1,\n            \"name\": \"Goku\",\n            \"ki\": \"60.000.000\",\n            \"maxKi\": \"90 Septillion\",\n            \"race\": \"Saiyan\",\n            \"gender\": \"Male\",\n            \"description\": \"El protagonista de la serie, conocido por su gran poder y personalidad amigable. Originalmente enviado a la Tierra como un infante volador con la misión de conquistarla. Sin embargo, el caer por un barranco le proporcionó un brutal golpe que si bien casi lo mata, este alteró su memoria y anuló todos los instintos violentos de su especie, lo que lo hizo crecer con un corazón puro y bondadoso, pero conservando todos los poderes de su raza. No obstante, en la nueva continuidad de Dragon Ball se establece que él fue enviado por sus padres a la Tierra con el objetivo de sobrevivir a toda costa a la destrucción de su planeta por parte de Freeza. Más tarde, Kakarot, ahora conocido como Son Goku, se convertiría en el príncipe consorte del monte Fry-pan y líder de los Guerreros Z, así como el mayor defensor de la Tierra y del Universo 7, logrando mantenerlos a salvo de la destrucción en innumerables ocasiones, a pesar de no considerarse a sí mismo como un héroe o salvador.\",\n            \"image\": \"https://dragonball-api.com/characters/goku_normal.webp\",\n            \"affiliation\": \"Z Fighter\",\n            \"deletedAt\": null\n        },\n        {\n            \"id\": 2,\n            \"name\": \"Vegeta\",\n            \"ki\": \"54.000.000\",\n            \"maxKi\": \"19.84 Septillion\",\n            \"race\": \"Saiyan\",\n            \"gender\": \"Male\",\n            \"description\": \"Príncipe de los Saiyans, inicialmente un villano, pero luego se une a los Z Fighters. A pesar de que a inicios de Dragon Ball Z, Vegeta cumple un papel antagónico, poco después decide rebelarse ante el Imperio de Freeza, volviéndose un aliado clave para los Guerreros Z. Con el paso del tiempo llegaría a cambiar su manera de ser, optando por permanecer y vivir en la Tierra para luchar a su lado contra las inminentes adversidades que superar. Junto con Piccolo, él es de los antiguos enemigos de Goku que ha evolucionando al pasar de ser un villano y antihéroe, a finalmente un héroe a lo largo del transcurso de la historia, convirtiéndose así en el deuteragonista de la serie.\",\n            \"image\": \"https://dragonball-api.com/characters/vegeta_normal.webp\",\n            \"affiliation\": \"Z Fighter\",\n            \"deletedAt\": null\n        },\n        {\n            \"id\": 3,\n            \"name\": \"Piccolo\",\n            \"ki\": \"2.000.000\",\n            \"maxKi\": \"500.000.000\",\n            \"race\": \"Namekian\",\n            \"gender\": \"Male\",\n            \"description\": \"Es un namekiano que surgió tras ser creado en los últimos momentos de vida de su padre, siendo su actual reencarnación. Aunque en un principio fue el archienemigo de Son Goku, con el paso del tiempo fue haciéndose menos malvado hasta finalmente convertirse en un ser bondadoso y miembro de los Guerreros Z. A través del tiempo, también comenzó a tomarle cariño a su discípulo Son Gohan, a quien veía como una especie de \\\"vástago\\\" y formando un lazo de amistad con este.\",\n            \"image\": \"https://dragonball-api.com/characters/picolo_normal.webp\",\n            \"affiliation\": \"Z Fighter\",\n            \"deletedAt\": null\n        },\n        {\n            \"id\": 4,\n            \"name\": \"Bulma\",\n            \"ki\": \"0\",\n            \"maxKi\": \"0\",\n            \"race\": \"Human\",\n            \"gender\": \"Female\",\n            \"description\": \"Bulma es la protagonista femenina de la serie manga Dragon Ball y sus adaptaciones al anime Dragon Ball, Dragon Ball Z, Dragon Ball Super y Dragon Ball GT. Es hija del Dr. Brief y su esposa Panchy, hermana menor de Tights y una gran amiga de Son Goku con quien inicia la búsqueda de las Esferas del Dragón. En Dragon Ball Z tuvo a Trunks, primogénito de quien sería su esposo Vegeta, a su hija Bra[3] y su hijo adulto del tiempo alterno Trunks del Futuro Alternativo.\",\n            \"image\": \"https://dragonball-api.com/characters/bulma.webp\",\n            \"affiliation\": \"Z Fighter\",\n            \"deletedAt\": null\n        },\n        {\n            \"id\": 5,\n            \"name\": \"Freezer\",\n            \"ki\": \"530.000\",\n            \"maxKi\": \"52.71 Septillion\",\n            \"race\": \"Frieza Race\",\n            \"gender\": \"Male\",\n            \"description\": \"Freezer es el tirano espacial y el principal antagonista de la saga de Freezer.\",\n            \"image\": \"https://dragonball-api.com/characters/Freezer.webp\",\n            \"affiliation\": \"Army of Frieza\",\n            \"deletedAt\": null\n        },\n        {\n            \"id\": 6,\n            \"name\": \"Zarbon\",\n            \"ki\": \"20.000\",\n            \"maxKi\": \"30.000\",\n            \"race\": \"Frieza Race\",\n            \"gender\": \"Male\",\n            \"description\": \"Zarbon es uno de los secuaces de Freezer y un luchador poderoso.\",\n            \"image\": \"https://dragonball-api.com/characters/zarbon.webp\",\n            \"affiliation\": \"Army of Frieza\",\n            \"deletedAt\": null\n        },\n        {\n            \"id\": 7,\n            \"name\": \"Dodoria\",\n            \"ki\": \"18.000\",\n            \"maxKi\": \"20.000\",\n            \"race\": \"Frieza Race\",\n            \"gender\": \"Male\",\n            \"description\": \"Dodoria es otro secuaz de Freezer conocido por su brutalidad.\",\n            \"image\": \"https://dragonball-api.com/characters/dodoria.webp\",\n            \"affiliation\": \"Army of Frieza\",\n            \"deletedAt\": null\n        },\n        {\n            \"id\": 8,\n            \"name\": \"Ginyu\",\n            \"ki\": \"9.000\",\n            \"maxKi\": \"25.000\",\n            \"race\": \"Frieza Race\",\n            \"gender\": \"Male\",\n            \"description\": \"Ginyu es el líder del la élite de mercenarios de mayor prestigio del Ejército de Freeza, la cual lleva el nombre de Fuerzas Especiales Ginew en su honor[9].\",\n            \"image\": \"https://dragonball-api.com/characters/ginyu.webp\",\n            \"affiliation\": \"Army of Frieza\",\n            \"deletedAt\": null\n        },\n        {\n            \"id\": 9,\n            \"name\": \"Celula\",\n            \"ki\": \"250.000.000\",\n            \"maxKi\": \"5 Billion\",\n            \"race\": \"Android\",\n            \"gender\": \"Male\",\n            \"description\": \"Cell conocido como Célula en España, es un bioandroide creado por la computadora del Dr. Gero, quien vino del futuro de la línea 3 con la intención de vengarse de Goku por haber acabado con el Ejército del Listón Rojo, y con ello el sueño de todo villano: dominar el mundo. Es el antagonista principal del Arco de los Androides y Cell.\",\n            \"image\": \"https://dragonball-api.com/characters/celula.webp\",\n            \"affiliation\": \"Freelancer\",\n            \"deletedAt\": null\n        },\n        {\n            \"id\": 10,\n            \"name\": \"Gohan\",\n            \"ki\": \"45.000.000\",\n            \"maxKi\": \"40 septillion\",\n            \"race\": \"Saiyan\",\n            \"gender\": \"Male\",\n            \"description\": \"Son Gohanda en su tiempo en España, o simplemente Gohan en Hispanoamérica, es uno de los personajes principales de los arcos argumentales de Dragon Ball Z, Dragon Ball Super y Dragon Ball GT. Es un mestizo entre saiyano y humano terrícola. Es el primer hijo de Son Goku y Chi-Chi, hermano mayor de Son Goten, esposo de Videl y padre de Pan.\",\n            \"image\": \"https://dragonball-api.com/characters/gohan.webp\",\n            \"affiliation\": \"Z Fighter\",\n            \"deletedAt\": null\n        }\n    ],\n    \"meta\": {\n        \"totalItems\": 58,\n        \"itemCount\": 10,\n        \"itemsPerPage\": 10,\n        \"totalPages\": 6,\n        \"currentPage\": 1\n    },\n    \"links\": {\n        \"first\": \"https://dragonball-api.com/api/characters?limit=10\",\n        \"previous\": \"\",\n        \"next\": \"https://dragonball-api.com/api/characters?page=2&limit=10\",\n        \"last\": \"https://dragonball-api.com/api/characters?page=6&limit=10\"\n    }\n}\n ```"
			},
			"response": []
		},
		{
			"name": "Filtrar por raza y afiliación",
			"request": {
				"auth": {
					"type": "noauth"
				},
				"method": "GET",
				"header": [],
				"url": {
					"raw": "https://dragonball-api.com/api/characters?race=Saiyan&affiliation=Z fighter",
					"protocol": "https",
					"host": [
						"dragonball-api",
						"com"
					],
					"path": [
						"api",
						"characters"
					],
					"query": [
						{
							"key": "race",
							"value": "Saiyan"
						},
						{
							"key": "affiliation",
							"value": "Z fighter"
						}
					]
				},
				"description": "Esta URL nos permite filtrar todos los personajes por raza y afiliación.\n\n``` json\n[\n    {\n        \"id\": 1,\n        \"name\": \"Goku\",\n        \"ki\": \"60.000.000\",\n        \"maxKi\": \"90 Septillion\",\n        \"race\": \"Saiyan\",\n        \"gender\": \"Male\",\n        \"description\": \"El protagonista de la serie, conocido por su gran poder y personalidad amigable. Originalmente enviado a la Tierra como un infante volador con la misión de conquistarla. Sin embargo, el caer por un barranco le proporcionó un brutal golpe que si bien casi lo mata, este alteró su memoria y anuló todos los instintos violentos de su especie, lo que lo hizo crecer con un corazón puro y bondadoso, pero conservando todos los poderes de su raza. No obstante, en la nueva continuidad de Dragon Ball se establece que él fue enviado por sus padres a la Tierra con el objetivo de sobrevivir a toda costa a la destrucción de su planeta por parte de Freeza. Más tarde, Kakarot, ahora conocido como Son Goku, se convertiría en el príncipe consorte del monte Fry-pan y líder de los Guerreros Z, así como el mayor defensor de la Tierra y del Universo 7, logrando mantenerlos a salvo de la destrucción en innumerables ocasiones, a pesar de no considerarse a sí mismo como un héroe o salvador.\",\n        \"image\": \"https://dragonball-api.com/characters/goku_normal.webp\",\n        \"affiliation\": \"Z Fighter\",\n        \"deletedAt\": null\n    },\n    {\n        \"id\": 2,\n        \"name\": \"Vegeta\",\n        \"ki\": \"54.000.000\",\n        \"maxKi\": \"19.84 Septillion\",\n        \"race\": \"Saiyan\",\n        \"gender\": \"Male\",\n        \"description\": \"Príncipe de los Saiyans, inicialmente un villano, pero luego se une a los Z Fighters. A pesar de que a inicios de Dragon Ball Z, Vegeta cumple un papel antagónico, poco después decide rebelarse ante el Imperio de Freeza, volviéndose un aliado clave para los Guerreros Z. Con el paso del tiempo llegaría a cambiar su manera de ser, optando por permanecer y vivir en la Tierra para luchar a su lado contra las inminentes adversidades que superar. Junto con Piccolo, él es de los antiguos enemigos de Goku que ha evolucionando al pasar de ser un villano y antihéroe, a finalmente un héroe a lo largo del transcurso de la historia, convirtiéndose así en el deuteragonista de la serie.\",\n        \"image\": \"https://dragonball-api.com/characters/vegeta_normal.webp\",\n        \"affiliation\": \"Z Fighter\",\n        \"deletedAt\": null\n    },\n    {\n        \"id\": 10,\n        \"name\": \"Gohan\",\n        \"ki\": \"45.000.000\",\n        \"maxKi\": \"40 septillion\",\n        \"race\": \"Saiyan\",\n        \"gender\": \"Male\",\n        \"description\": \"Son Gohanda en su tiempo en España, o simplemente Gohan en Hispanoamérica, es uno de los personajes principales de los arcos argumentales de Dragon Ball Z, Dragon Ball Super y Dragon Ball GT. Es un mestizo entre saiyano y humano terrícola. Es el primer hijo de Son Goku y Chi-Chi, hermano mayor de Son Goten, esposo de Videl y padre de Pan.\",\n        \"image\": \"https://dragonball-api.com/characters/gohan.webp\",\n        \"affiliation\": \"Z Fighter\",\n        \"deletedAt\": null\n    },\n    {\n        \"id\": 15,\n        \"name\": \"Gotenks\",\n        \"ki\": \"65.600.000\",\n        \"maxKi\": \"34.8 Billion\",\n        \"race\": \"Saiyan\",\n        \"gender\": \"Male\",\n        \"description\": \" Gotenks también conocido inicialmente como Gotrunk en el doblaje al español de España, es el resultado de la Danza de la Fusión llevada a cabo correctamente por Goten y Trunks.\",\n        \"image\": \"https://dragonball-api.com/characters/Gotenks_Artwork.webp\",\n        \"affiliation\": \"Z Fighter\",\n        \"deletedAt\": null\n    },\n    {\n        \"id\": 16,\n        \"name\": \"Trunks\",\n        \"ki\": \"50.000.000\",\n        \"maxKi\": \"37.4 septllion\",\n        \"race\": \"Saiyan\",\n        \"gender\": \"Male\",\n        \"description\": \"Hijo de Vegeta y Bulma. Es un mestizo entre humano terrícola y Saiyano nacido en la Tierra, e hijo de Bulma y Vegeta, el cual es introducido en el Arco de los Androides y Cell. Más tarde en su vida como joven, se termina convirtiendo en un luchador de artes marciales, el mejor amigo de Son Goten y en el hermano mayor de su hermana Bra.\",\n        \"image\": \"https://dragonball-api.com/characters/Trunks_Buu_Artwork.webp\",\n        \"affiliation\": \"Z Fighter\",\n        \"deletedAt\": null\n    },\n    {\n        \"id\": 18,\n        \"name\": \"Bardock\",\n        \"ki\": \"450.000\",\n        \"maxKi\": \"180.000.000\",\n        \"race\": \"Saiyan\",\n        \"gender\": \"Male\",\n        \"description\": \"Es un saiyano de clase baja proveniente del Planeta Vegeta del Universo 7. Pertenece al Ejército Saiyano, que está bajo el liderazgo del Rey Vegeta, y es jefe de su escuadrón durante la anexión del planeta por parte de las fuerzas coloniales del Imperio de Freeza. Él es el esposo de Gine y padre biológico de Kakarotto y Raditz.\",\n        \"image\": \"https://dragonball-api.com/characters/Bardock_Artwork.webp\",\n        \"affiliation\": \"Z Fighter\",\n        \"deletedAt\": null\n    },\n    {\n        \"id\": 65,\n        \"name\": \"Gogeta\",\n        \"ki\": \"250 Billion\",\n        \"maxKi\": \"15 septillion\",\n        \"race\": \"Saiyan\",\n        \"gender\": \"Male\",\n        \"description\": \"Gogeta es la fusión resultante de Son Goku y Vegeta, cuando realizan la Danza de la Fusión correctamente para enfrentarse a Broly. Su voz es una voz dual que contiene las voces de Goku y Vegeta. Junto con el poder todopoderoso de los dos, con la astucia y perspicacia de Vegeta, y la habilidad pródiga de las artes marciales de Goku, es uno de los guerreros más temibles para desafiar a una pelea.\",\n        \"image\": \"https://dragonball-api.com/transformaciones/gogeta.webp\",\n        \"affiliation\": \"Z Fighter\",\n        \"deletedAt\": null\n    },\n    {\n        \"id\": 66,\n        \"name\": \"Vegetto\",\n        \"ki\": \"180 Billion\",\n        \"maxKi\": \"10.8 Septillion\",\n        \"race\": \"Saiyan\",\n        \"gender\": \"Male\",\n        \"description\": \"Vegetto es el personaje más fuerte dentro del manga original y uno de los personajes más poderosos de toda la serie en general. Su poder es el resultado del máximo poder combinado de Goku y Vegeta, multiplicado varias veces su fuerza, siendo una de las fusiones más poderosas dentro de la franquicia.\",\n        \"image\": \"https://dragonball-api.com/transformaciones/Vegetto.webp\",\n        \"affiliation\": \"Z Fighter\",\n        \"deletedAt\": null\n    }\n]\n ```"
			},
			"response": []
		},
		{
			"name": "Mostrar las transformaciones",
			"request": {
				"auth": {
					"type": "noauth"
				},
				"method": "GET",
				"header": [],
				"url": {
					"raw": "https://dragonball-api.com/api/characters/1",
					"protocol": "https",
					"host": [
						"dragonball-api",
						"com"
					],
					"path": [
						"api",
						"characters",
						"1"
					]
				},
				"description": "Esta petición nos muestra todas las transformaciones de un personaje en particular.\n\n``` json\n{\n    \"id\": 1,\n    \"name\": \"Goku\",\n    \"ki\": \"60.000.000\",\n    \"maxKi\": \"90 Septillion\",\n    \"race\": \"Saiyan\",\n    \"gender\": \"Male\",\n    \"description\": \"El protagonista de la serie, conocido por su gran poder y personalidad amigable. Originalmente enviado a la Tierra como un infante volador con la misión de conquistarla. Sin embargo, el caer por un barranco le proporcionó un brutal golpe que si bien casi lo mata, este alteró su memoria y anuló todos los instintos violentos de su especie, lo que lo hizo crecer con un corazón puro y bondadoso, pero conservando todos los poderes de su raza. No obstante, en la nueva continuidad de Dragon Ball se establece que él fue enviado por sus padres a la Tierra con el objetivo de sobrevivir a toda costa a la destrucción de su planeta por parte de Freeza. Más tarde, Kakarot, ahora conocido como Son Goku, se convertiría en el príncipe consorte del monte Fry-pan y líder de los Guerreros Z, así como el mayor defensor de la Tierra y del Universo 7, logrando mantenerlos a salvo de la destrucción en innumerables ocasiones, a pesar de no considerarse a sí mismo como un héroe o salvador.\",\n    \"image\": \"https://dragonball-api.com/characters/goku_normal.webp\",\n    \"affiliation\": \"Z Fighter\",\n    \"deletedAt\": null,\n    \"originPlanet\": {\n        \"id\": 3,\n        \"name\": \"Vegeta\",\n        \"isDestroyed\": true,\n        \"description\": \"El planeta Vegeta, conocido como planeta Plant antes del fin de la Guerra Saiyan-tsufruiana en el año 730, es un planeta rocoso ficticio de la serie de manga y anime Dragon Ball y localizado en la Vía Láctea de las Galaxias del Norte del Universo 7 hasta su destrucción a manos de Freezer en los años 737-739. Planeta natal de los Saiyans, destruido por Freezer. Anteriormente conocido como Planeta Plant.\",\n        \"image\": \"https://dragonball-api.com/planetas/Planeta_Vegeta_en_Dragon_Ball_Super_Broly.webp\",\n        \"deletedAt\": null\n    },\n    \"transformations\": [\n        {\n            \"id\": 1,\n            \"name\": \"Goku SSJ\",\n            \"image\": \"https://dragonball-api.com/transformaciones/goku_ssj.webp\",\n            \"ki\": \"3 Billion\",\n            \"deletedAt\": null\n        },\n        {\n            \"id\": 2,\n            \"name\": \"Goku SSJ2\",\n            \"image\": \"https://dragonball-api.com/transformaciones/goku_ssj2.webp\",\n            \"ki\": \"6 Billion\",\n            \"deletedAt\": null\n        },\n        {\n            \"id\": 3,\n            \"name\": \"Goku SSJ3\",\n            \"image\": \"https://dragonball-api.com/transformaciones/goku_ssj3.webp\",\n            \"ki\": \"24 Billion\",\n            \"deletedAt\": null\n        },\n        {\n            \"id\": 4,\n            \"name\": \"Goku SSJ4\",\n            \"image\": \"https://dragonball-api.com/transformaciones/goku_ssj4.webp\",\n            \"ki\": \"2 Quadrillion\",\n            \"deletedAt\": null\n        },\n        {\n            \"id\": 5,\n            \"name\": \"Goku SSJB\",\n            \"image\": \"https://dragonball-api.com/transformaciones/goku_ssjb.webp\",\n            \"ki\": \"9 Quintillion\",\n            \"deletedAt\": null\n        },\n        {\n            \"id\": 44,\n            \"name\": \"Goku Ultra Instinc\",\n            \"image\": \"https://dragonball-api.com/transformaciones/goku_ultra.webp\",\n            \"ki\": \"90 Septillion\",\n            \"deletedAt\": null\n        }\n    ]\n}\n ```"
			},
			"response": []
		},
		{
			"name": "Trae todos los planetas",
			"request": {
				"auth": {
					"type": "noauth"
				},
				"method": "GET",
				"header": [],
				"url": {
					"raw": "https://dragonball-api.com/api/planets",
					"protocol": "https",
					"host": [
						"dragonball-api",
						"com"
					],
					"path": [
						"api",
						"planets"
					]
				},
				"description": "Esta URL trae todos los planetas cargados en la página.\n\n``` json\n{\n    \"items\": [\n        {\n            \"id\": 1,\n            \"name\": \"Namek\",\n            \"isDestroyed\": true,\n            \"description\": \"Planeta natal de los Namekianos. Escenario de importantes batallas y la obtención de las Dragon Balls de Namek.\",\n            \"image\": \"https://dragonball-api.com/planetas/Namek_U7.webp\",\n            \"deletedAt\": null\n        },\n        {\n            \"id\": 2,\n            \"name\": \"Tierra\",\n            \"isDestroyed\": false,\n            \"description\": \"La Tierra también llamado Mundo del Dragón (Dragon World), es el planeta principal donde se desarrolla la serie de Dragon Ball. Se encuentra en el Sistema Solar de la Vía Láctea de las Galaxias del Norte del Universo 7, lugar que supervisa el Kaio del Norte, y tiene su equivalente en el Universo 6. El hogar de los terrícolas y los Guerreros Z. Ha sido atacado en varias ocasiones por enemigos poderosos.\",\n            \"image\": \"https://dragonball-api.com/planetas/Tierra_Dragon_Ball_Z.webp\",\n            \"deletedAt\": null\n        },\n        {\n            \"id\": 3,\n            \"name\": \"Vegeta\",\n            \"isDestroyed\": true,\n            \"description\": \"El planeta Vegeta, conocido como planeta Plant antes del fin de la Guerra Saiyan-tsufruiana en el año 730, es un planeta rocoso ficticio de la serie de manga y anime Dragon Ball y localizado en la Vía Láctea de las Galaxias del Norte del Universo 7 hasta su destrucción a manos de Freezer en los años 737-739. Planeta natal de los Saiyans, destruido por Freezer. Anteriormente conocido como Planeta Plant.\",\n            \"image\": \"https://dragonball-api.com/planetas/Planeta_Vegeta_en_Dragon_Ball_Super_Broly.webp\",\n            \"deletedAt\": null\n        },\n        {\n            \"id\": 4,\n            \"name\": \"Freezer No. 79\",\n            \"isDestroyed\": true,\n            \"description\": \"Planeta artificial utilizado por Freezer como base de operaciones y centro de clonación.\",\n            \"image\": \"https://dragonball-api.com/planetas/PlanetaFreezer.webp\",\n            \"deletedAt\": null\n        },\n        {\n            \"id\": 5,\n            \"name\": \"Kanassa\",\n            \"isDestroyed\": true,\n            \"description\": \"Planeta habitado por los Kanassans y conocido por la lucha entre Bardock y los habitantes del planeta.\",\n            \"image\": \"https://dragonball-api.com/planetas/800px-PlanetKannasa.webp\",\n            \"deletedAt\": null\n        },\n        {\n            \"id\": 6,\n            \"name\": \"Monmar\",\n            \"isDestroyed\": false,\n            \"description\": \"Planeta donde Gohan y Krillin encontraron las Dragon Balls para revivir a sus amigos durante la Saga de Namek.\",\n            \"image\": \"https://dragonball-api.com/planetas/monmar.webp\",\n            \"deletedAt\": null\n        },\n        {\n            \"id\": 7,\n            \"name\": \"Yardrat\",\n            \"isDestroyed\": false,\n            \"description\": \"Planeta de la técnica Instant Transmission, aprendida por Goku durante su estancia.\",\n            \"image\": \"https://dragonball-api.com/planetas/PlanetYardrat.webp\",\n            \"deletedAt\": null\n        },\n        {\n            \"id\": 11,\n            \"name\": \"Kaiō del Norte\",\n            \"isDestroyed\": false,\n            \"description\": \"El Planeta Kaio se encuentra al final del largo Camino de la Serpiente. Es donde viven el Kaio del Norte, su mascota Bubbles, al que utiliza como parte de su entrenamiento, y Gregory.\",\n            \"image\": \"https://dragonball-api.com/planetas/Planeta_del_Kaio_del_Norte.webp\",\n            \"deletedAt\": null\n        },\n        {\n            \"id\": 13,\n            \"name\": \"Makyo\",\n            \"isDestroyed\": false,\n            \"description\": \"Makyo es un planeta y la fuente de alimentación de todos los malévolos, especialmente Garlic Jr., que solo aparece durante el Arco de Garlic Jr. de Dragon Ball Z.\",\n            \"image\": \"https://dragonball-api.com/planetas/Makyo_Star.webp\",\n            \"deletedAt\": null\n        },\n        {\n            \"id\": 14,\n            \"name\": \"Babari\",\n            \"isDestroyed\": false,\n            \"description\": \"Planeta habitado por los Babari, es un planeta telúrico del Universo 10 donde residen los babarianos, hizo su primera aparición en el episodio 54 de Dragon Ball Super. Es donde Tarble, el hermano de Vegeta, se refugió.\",\n            \"image\": \"https://dragonball-api.com/planetas/Planeta_Babari.webp\",\n            \"deletedAt\": null\n        }\n    ],\n    \"meta\": {\n        \"totalItems\": 20,\n        \"itemCount\": 10,\n        \"itemsPerPage\": 10,\n        \"totalPages\": 2,\n        \"currentPage\": 1\n    },\n    \"links\": {\n        \"first\": \"https://dragonball-api.com/api/planets?limit=10\",\n        \"previous\": \"\",\n        \"next\": \"https://dragonball-api.com/api/planets?page=2&limit=10\",\n        \"last\": \"https://dragonball-api.com/api/planets?page=2&limit=10\"\n    }\n}\n ```"
			},
			"response": []
		},
		{
			"name": "Buscar planeta por ID",
			"request": {
				"auth": {
					"type": "noauth"
				},
				"method": "GET",
				"header": [],
				"url": {
					"raw": "https://dragonball-api.com/api/planets/1",
					"protocol": "https",
					"host": [
						"dragonball-api",
						"com"
					],
					"path": [
						"api",
						"planets",
						"1"
					]
				},
				"description": "Esta petición trae el planeta al cual le corresponde la ID seleccionada.\n\n``` json\n{\n    \"id\": 1,\n    \"name\": \"Namek\",\n    \"isDestroyed\": true,\n    \"description\": \"Planeta natal de los Namekianos. Escenario de importantes batallas y la obtención de las Dragon Balls de Namek.\",\n    \"image\": \"https://dragonball-api.com/planetas/Namek_U7.webp\",\n    \"deletedAt\": null,\n    \"characters\": [\n        {\n            \"id\": 3,\n            \"name\": \"Piccolo\",\n            \"ki\": \"2.000.000\",\n            \"maxKi\": \"500.000.000\",\n            \"race\": \"Namekian\",\n            \"gender\": \"Male\",\n            \"description\": \"Es un namekiano que surgió tras ser creado en los últimos momentos de vida de su padre, siendo su actual reencarnación. Aunque en un principio fue el archienemigo de Son Goku, con el paso del tiempo fue haciéndose menos malvado hasta finalmente convertirse en un ser bondadoso y miembro de los Guerreros Z. A través del tiempo, también comenzó a tomarle cariño a su discípulo Son Gohan, a quien veía como una especie de \\\"vástago\\\" y formando un lazo de amistad con este.\",\n            \"image\": \"https://dragonball-api.com/characters/picolo_normal.webp\",\n            \"affiliation\": \"Z Fighter\",\n            \"deletedAt\": null\n        },\n        {\n            \"id\": 8,\n            \"name\": \"Ginyu\",\n            \"ki\": \"9.000\",\n            \"maxKi\": \"25.000\",\n            \"race\": \"Frieza Race\",\n            \"gender\": \"Male\",\n            \"description\": \"Ginyu es el líder del la élite de mercenarios de mayor prestigio del Ejército de Freeza, la cual lleva el nombre de Fuerzas Especiales Ginew en su honor[9].\",\n            \"image\": \"https://dragonball-api.com/characters/ginyu.webp\",\n            \"affiliation\": \"Army of Frieza\",\n            \"deletedAt\": null\n        },\n        {\n            \"id\": 21,\n            \"name\": \"Dende\",\n            \"ki\": \"3.200\",\n            \"maxKi\": \"3.200\",\n            \"race\": \"Namekian\",\n            \"gender\": \"Male\",\n            \"description\": \"Sucesor de Piccolo como el nuevo Namekian protector de la Tierra. Es un pequeño namekiano, que vivía en el poblado de Moori, junto a su hermano Scargo y otros tantos de su especie. Es el hijo 108 del Gran Patriarca y posteriormente Dios de la Tierra, sustituyendo a Dios.\",\n            \"image\": \"https://dragonball-api.com/characters/Dende_Artwork.webp\",\n            \"affiliation\": \"Z Fighter\",\n            \"deletedAt\": null\n        },\n        {\n            \"id\": 29,\n            \"name\": \"Nail\",\n            \"ki\": \"42.000 \",\n            \"maxKi\": \"42.000\",\n            \"race\": \"Namekian\",\n            \"gender\": \"Male\",\n            \"description\": \"Es un Namekiano (habitante del planeta Namek), que se caracteriza por formar parte de los escasos miembros de la \\\"estirpe guerrera\\\", y ser el más poderoso entre ellos junto a Piccolo.\",\n            \"image\": \"https://dragonball-api.com/characters/Nail_Artwork.webp\",\n            \"affiliation\": \"Z Fighter\",\n            \"deletedAt\": null\n        }\n    ]\n}\n ```"
			},
			"response": []
		},
		{
			"name": "Filtrar por planetas destruidos",
			"request": {
				"auth": {
					"type": "noauth"
				},
				"method": "GET",
				"header": [],
				"url": {
					"raw": "https://dragonball-api.com/api/planets?isDestroyed=true",
					"protocol": "https",
					"host": [
						"dragonball-api",
						"com"
					],
					"path": [
						"api",
						"planets"
					],
					"query": [
						{
							"key": "isDestroyed",
							"value": "true"
						}
					]
				},
				"description": "Esta URL fiiltra por todos los plantas que estan destruidos.\n\n``` json\n[\n    {\n        \"id\": 1,\n        \"name\": \"Namek\",\n        \"isDestroyed\": true,\n        \"description\": \"Planeta natal de los Namekianos. Escenario de importantes batallas y la obtención de las Dragon Balls de Namek.\",\n        \"image\": \"https://dragonball-api.com/planetas/Namek_U7.webp\",\n        \"deletedAt\": null\n    },\n    {\n        \"id\": 3,\n        \"name\": \"Vegeta\",\n        \"isDestroyed\": true,\n        \"description\": \"El planeta Vegeta, conocido como planeta Plant antes del fin de la Guerra Saiyan-tsufruiana en el año 730, es un planeta rocoso ficticio de la serie de manga y anime Dragon Ball y localizado en la Vía Láctea de las Galaxias del Norte del Universo 7 hasta su destrucción a manos de Freezer en los años 737-739. Planeta natal de los Saiyans, destruido por Freezer. Anteriormente conocido como Planeta Plant.\",\n        \"image\": \"https://dragonball-api.com/planetas/Planeta_Vegeta_en_Dragon_Ball_Super_Broly.webp\",\n        \"deletedAt\": null\n    },\n    {\n        \"id\": 4,\n        \"name\": \"Freezer No. 79\",\n        \"isDestroyed\": true,\n        \"description\": \"Planeta artificial utilizado por Freezer como base de operaciones y centro de clonación.\",\n        \"image\": \"https://dragonball-api.com/planetas/PlanetaFreezer.webp\",\n        \"deletedAt\": null\n    },\n    {\n        \"id\": 5,\n        \"name\": \"Kanassa\",\n        \"isDestroyed\": true,\n        \"description\": \"Planeta habitado por los Kanassans y conocido por la lucha entre Bardock y los habitantes del planeta.\",\n        \"image\": \"https://dragonball-api.com/planetas/800px-PlanetKannasa.webp\",\n        \"deletedAt\": null\n    }\n]\n ```"
			},
			"response": []
		}
	]
}